{
  "@context": ["https://www.w3.org/ns/credentials/v2"],
  "type": ["VerifiablePresentation"],
  "holder": {
    "id": "did:ebsi:00012345",
    "email": "my@example.local"
  },
  "verifiableCredential": [
    "eyJ0eXAiOiJKV1QiLCJhbGciOiJFUzI1NiIsImtpZCI6ImRpZDplYnNpOnp2SFdYMzU5QTNDdmZKbkNZYUFpQWRlI0YwcjVPeXRfbGFodnZ6Nk1XbFlzM21jWU5LWmlpUWRVZnF2OHRzaEhOOXcifQ.eyJpc3MiOiJkaWQ6ZWJzaTp6dkhXWDM1OUEzQ3ZmSm5DWWFBaUFkZSIsInN1YiI6ImRpZDplYnNpOnpkUGoxR1BYamZFUlh4WFBFMVlUWWRKIiwiaWF0IjoiMjAyMC0wNi0yMlQxNDoxMTo0NFoiLCJuYmYiOiIyMDIxLTExLTAxVDAwOjAwOjAwWiIsImp0aSI6InVybjp1dWlkOjA4ZTI2ZDIyLThkY2EtNDU1OC05YzE0LTZlN2FhNzI3NWI5YiIsInZjIjp7IkBjb250ZXh0IjpbImh0dHBzOi8vd3d3LnczLm9yZy8yMDE4L2NyZWRlbnRpYWxzL3YxIl0sImlkIjoidXJuOnV1aWQ6MDhlMjZkMjItOGRjYS00NTU4LTljMTQtNmU3YWE3Mjc1YjliIiwidHlwZSI6WyJWZXJpZmlhYmxlQ3JlZGVudGlhbCIsIlZlcmlmaWFibGVBdHRlc3RhdGlvbiIsIlZlcmlmaWFibGVBdXRob3Jpc2F0aW9uIl0sImlzc3VlciI6ImRpZDplYnNpOnp2SFdYMzU5QTNDdmZKbkNZYUFpQWRlIiwiaXNzdWFuY2VEYXRlIjoiMjAyMS0xMS0wMVQwMDowMDowMFoiLCJ2YWxpZEZyb20iOiIyMDIxLTExLTAxVDAwOjAwOjAwWiIsImV4cGlyYXRpb25EYXRlIjoiMjAyNC0wNi0yMlQxNDoxMTo0NFoiLCJpc3N1ZWQiOiIyMDIwLTA2LTIyVDE0OjExOjQ0WiIsImNyZWRlbnRpYWxTdWJqZWN0Ijp7ImlkIjoiZGlkOmVic2k6emRQajFHUFhqZkVSWHhYUEUxWVRZZEoiLCJhY2Nlc3MiOlsib25ib2FyZCJdfSwiY3JlZGVudGlhbFN0YXR1cyI6eyJpZCI6Imh0dHBzOi8vYXBpLnByZXByb2QuZWJzaS5ldS90cnVzdGVkLWlzc3VlcnMtcmVnaXN0cnkvdjMvaXNzdWVycy9kaWQ6ZWJzaTp6eXJNRzhUOXhZYk5vU3d5UWE0U0dNSi9wcm94eS82Y2M1ZmNjNjIxZDgwOTg5NzdkMzc4ZWM3YmY2M2Y5YWQwYjIwNGQ1NmJiNjA0Zjc1YmM5MjkwZTcwMzNhYzg0L2NyZWRlbnRpYWxzL3N0YXR1cy81IzEyOTQzMCIsInR5cGUiOiJTdGF0dXNMaXN0MjAyMUVudHJ5Iiwic3RhdHVzUHVycG9zZSI6InJldm9jYXRpb24iLCJzdGF0dXNMaXN0SW5kZXgiOiIxMjkyMzAiLCJzdGF0dXNMaXN0Q3JlZGVudGlhbCI6Imh0dHBzOi8vYXBpLnByZXByb2QuZWJzaS5ldS90cnVzdGVkLWlzc3VlcnMtcmVnaXN0cnkvdjMvaXNzdWVycy9kaWQ6ZWJzaTp6eXJNRzhUOXhZYk5vU3d5UWE0U0dNSi9wcm94eS82Y2M1ZmNjNjIxZDgwOTg5NzdkMzc4ZWM3YmY2M2Y5YWQwYjIwNGQ1NmJiNjA0Zjc1YmM5MjkwZTcwMzNhYzg0L2NyZWRlbnRpYWxzL3N0YXR1cy81In0sImNyZWRlbnRpYWxTY2hlbWEiOnsiaWQiOiJodHRwczovL2FwaS5wcmVwcm9kLmVic2kuZXUvdHJ1c3RlZC1zY2hlbWFzLXJlZ2lzdHJ5L3YxL3NjaGVtYXMvMHg5MGJiYjVlMGViZWU2NTM4Y2RhZTQ0ZGI5YTZmOGMzOGQ4NWM1YTRkNjllOTJlMGM2MzNlYTE5ZTVhZWIxOTdmIiwidHlwZSI6IkZ1bGxKc29uU2NoZW1hVmFsaWRhdG9yMjAyMSJ9fX0.H6BFgrl8bAvGsLCk4gD12DIfUKH2W8gI2cFuRbF6eGV7fciGsr1XLxWp6jM4l9fuDXBQ6BLSVhZQR2B4uqIIrA"
  ]
}
